{
  "$schema": "../schemas/carousel-series.schema.json",
  "schemaVersion": 1,
  "id": "automation-day-carousel",
  "platform": "instagram",
  "format": "carousel-3x4",
  "status": "approved-for-render",
  "publish": false,
  "canvas": { "width": 1080, "height": 1440 },
  "safeZone": { "top": 120, "right": 120, "bottom": 120, "left": 120 },
  "contentSource": {
    "path": "content/automation-day-carousel.md",
    "sha256": "60d2bf8aa7f1629b07541dc2edad0fb0842fc6a4996b8d5094757578e3d13b47"
  },
  "captionSha256": "f8bce9ef45a2841aa10194d729e38fe08ba88db1691c278577ef5500f53db4bf",
  "designTokens": {
    "ink": "#101010",
    "paper": "#f4f1e9",
    "blue": "#1546e8",
    "grid": "rgba(21, 70, 232, 0.105)"
  },
  "layoutFamily": "process-diagram-carousel",
  "caption": [
    "Вчера я почти целый день потратил на то, чтобы автоматизировать один пост.",
    "Сначала это звучит как провал. Особенно если сам же и строишь контент-завод, который должен ускорять работу.",
    "Но на практике именно такие дни и показывают, где у тебя система, а где просто набор инструментов.",
    "На словах всё выглядело красиво: идея, текст, дизайн, публикация, аналитика. Хотелось собрать цепочку, в которой ИИ помогает на каждом этапе, а человек не делает всё руками, а управляет процессом.",
    "На деле быстро выяснилось, что слабое место не в том, может ли нейросеть что-то написать или нарисовать. Слабое место — в стыках между этапами. Дизайн оказался нестабильным, Codex неожиданно стал критически важной частью процесса, GitHub Pages сначала не отдавал готовый файл, а потом система вообще остановила рендер из-за того, что я изменил текст.",
    "И это, кстати, был хороший сбой. Потому что старый вариант не ушёл в публикацию случайно.",
    "В итоге я понял простую вещь: автоматизировать нужно не создание каждого отдельного поста, а производственную систему вокруг него.",
    "То есть не «пусть ИИ сделает мне контент», а «пусть система помогает превращать идею в хороший опубликованный материал и не даёт выпускать брак».",
    "Сейчас мой контент-завод выглядит примерно так: идея → арт-дирекшен → контент в GitHub → renderer → автоматический QA → публичный файл → Metricool → Instagram.",
    "И вот это уже гораздо больше похоже на рабочую конструкцию.",
    "Так что день ушёл не на один пост, а на то, чтобы этот пост вообще смог появиться внутри нормального процесса."
  ],
  "slides": [
    {
      "id": "slide-01",
      "mode": "statement",
      "headlineIndexes": [0, 1, 2],
      "text": ["Я потратил почти день,", "чтобы автоматизировать", "один пост", "И это оказалось полезнее, чем я думал"]
    },
    {
      "id": "slide-02",
      "mode": "pipeline",
      "headlineIndexes": [0],
      "text": ["Когда я задумывал контент-завод, всё выглядело просто:", "идея", "→", "текст", "→", "дизайн", "→", "публикация", "→", "аналитика", "Хотелось собрать систему, в которой человек не делает всё руками, а принимает решения."]
    },
    {
      "id": "slide-03",
      "mode": "criteria-list",
      "headlineIndexes": [0],
      "text": ["Первым сломался дизайн", "Оказалось, что ИИ может помочь с идеей макета, но это ещё не значит, что он умеет стабильно собирать хорошие карточки:", "— в нужном стиле", "— с нормальной типографикой", "— без случайного декора", "— с правильным фото", "— и точно по утверждённому тексту"]
    },
    {
      "id": "slide-04",
      "mode": "breakpoint",
      "headlineIndexes": [0, 2, 3],
      "text": ["Потом закончился Codex", "И тут вскрылась важная вещь:", "если для выпуска каждого поста нужен Codex,", "то это не контент-завод", "Это просто ручное производство с дорогим помощником."]
    },
    {
      "id": "slide-05",
      "mode": "breakpoint",
      "headlineIndexes": [0, 2, 3],
      "text": ["Потом выяснилось, что готовый макет — это ещё не публикация", "GitHub Pages сначала отдавал 404, а Metricool нужен публичный URL картинки.", "То есть между словами «макет готов»", "и «пост опубликован»", "тоже есть отдельный производственный слой."]
    },
    {
      "id": "slide-06",
      "mode": "breakpoint",
      "headlineIndexes": [0, 1, 3],
      "text": ["Потом я поправил текст", "И система снова остановилась", "Но на этот раз — правильно: она увидела, что исходник уже изменился, а макет собирается по старой версии.", "Старый вариант в публикацию не ушёл", "И это, пожалуй, был первый момент, когда завод повёл себя как завод, а не как набор случайных инструментов."]
    },
    {
      "id": "slide-07",
      "mode": "pipeline",
      "headlineIndexes": [0],
      "text": ["В итоге схема стала такой:", "идея", "↓", "арт-дирекшен", "↓", "контент в GitHub", "↓", "renderer", "↓", "автоматический QA", "↓", "публичный PNG", "↓", "Metricool", "↓", "Instagram", "А Codex нужен не для каждого поста, а только чтобы строить и улучшать саму систему."]
    },
    {
      "id": "slide-08",
      "mode": "statement",
      "headlineIndexes": [0, 1],
      "text": ["Главный вывод:", "контент-завод — это не генератор постов", "Пост с ИИ сегодня могут сделать почти все.", "Интереснее собрать систему, которая помогает стабильно превращать идею в хороший опубликованный материал."]
    },
    {
      "id": "slide-09",
      "mode": "closing",
      "headlineIndexes": [1, 2],
      "text": ["Вчера я почти целый день автоматизировал один пост.", "Звучит не очень эффективно", "Но именно после этого у меня впервые начал появляться настоящий контент-завод"]
    }
  ]
}
